{
  "artifact_url": "https://www.cia.gov/readingroom/docs/DOC_0000914052.pdf",
  "call_id": "CALL-PBSUCCESS",
  "canonical_landing_url": "https://www.cia.gov/readingroom/",
  "classification_note": "Originally Secret / RYBAT / PBSUCCESS; CIA Historical Review Program release",
  "collection": "PBSUCCESS",
  "doc_id": "CIA-1954-pbsuccess-001",
  "document_date": "1954-01-25",
  "evidence_status": "unreviewed",
  "local_raw_path": "/srv/Collab/mini.shops/blackindex/source-vault/raw/cia/pbsuccess/CIA-1954-pbsuccess-001.pdf",
  "mime_hint": "pdf",
  "native_id": "CIA Historical Review Program DOC_0000914052",
  "normalization_status": "pdf-no-text-layer",
  "normalized_sha256": null,
  "normalized_text_path": null,
  "original_filename": "url-ingest.WsPvAn.pdf",
  "record_group": null,
  "redaction_note": "Preserve sanitized operational identities and distinguish stated objectives/plans from actions later executed.",
  "retrieved_at": "2026-08-25T06:35:47+00:00",
  "schema_version": 1,
  "series": null,
  "sha256": "3616f95dd3d7e81d26dfd63ebf835ce5a1df140228b37647928b05c5965990b0",
  "size_bytes": 1192838,
  "source": "CIA",
  "source_url": "https://www.cia.gov/readingroom/docs/DOC_0000914052.pdf",
  "tags": [
    "pbsuccess",
    "guatemala",
    "arbenz",
    "cia",
    "covert-action",
    "psychological-operations",
    "regime-change"
  ],
  "title": "Proposed PP Program, Stage Two, PBSUCCESS",
  "year_bucket": "1954"
}
