{
  "artifact_url": "https://vault.fbi.gov/9-11%20Commission%20Report/9-11-investigation-2004-05-may",
  "call_id": "CALL-911-REVIEW007G-ABDULLAH-FBI-BUNDLES",
  "canonical_landing_url": "https://vault.fbi.gov/9-11%20Commission%20Report/9-11-investigation-2004-05-may",
  "classification_note": null,
  "collection": "9/11 Commission FBI Monthly Releases May 2004",
  "doc_id": "FBI-2004-9-11-commission-fbi-monthly-releases-may-2004-001",
  "document_date": null,
  "evidence_status": "unreviewed",
  "local_raw_path": "/srv/Collab/mini.shops/blackindex/source-vault/raw/fbi/9-11-commission-fbi-monthly-releases-may-2004/FBI-2004-9-11-commission-fbi-monthly-releases-may-2004-001.pdf",
  "mime_hint": "pdf",
  "native_id": "FBI-911-INV-2004-05-MAY",
  "normalization_status": "pdftotext",
  "normalized_sha256": "cf5ff24ce5a7149b831a62e70eed6334542dd0ad344579e5b8a50301f9c8382f",
  "normalized_text_path": "/srv/Collab/mini.shops/blackindex/normalized/text/FBI-2004-9-11-commission-fbi-monthly-releases-may-2004-001.txt",
  "original_filename": "url-ingest.TgXh8Y.pdf",
  "record_group": null,
  "redaction_note": null,
  "retrieved_at": "2026-09-26T06:12:37+00:00",
  "schema_version": 1,
  "series": null,
  "sha256": "10e32decc97abe530126a6b08c1ddb3b8f5a422e1ad7bd4b0ea83815b163715f",
  "size_bytes": 456219,
  "source": "FBI",
  "source_url": "https://vault.fbi.gov/9-11%20Commission%20Report/9-11-investigation-2004-05-may",
  "tags": [
    "9-11",
    "fbi",
    "mohdar-abdullah",
    "charles-sabah-toma",
    "advance-knowledge",
    "commission-source-files",
    "underlying-records",
    "official-fbi-release"
  ],
  "title": "FBI 9/11 Investigation \u2014 May 2004 Release Bundle",
  "year_bucket": "2004"
}
