{
  "artifact_url": "https://www.esd.whs.mil/Portals/54/Documents/DD/issuances/dodd/S-521081_placeholder.pdf",
  "call_id": "CALL-NC3-GOVERNANCE-001",
  "canonical_landing_url": "https://www.esd.whs.mil/Directives/issuances/dodd/",
  "classification_note": null,
  "collection": "DoD Controlled-Issuance Placeholders",
  "doc_id": "DOD-2017-dod-controlled-issuance-placeholders-001",
  "document_date": "2017-04-24",
  "evidence_status": "unreviewed",
  "local_raw_path": "/srv/Collab/mini.shops/blackindex/source-vault/raw/dod/dod-controlled-issuance-placeholders/DOD-2017-dod-controlled-issuance-placeholders-001.pdf",
  "mime_hint": "pdf",
  "native_id": "DoDD-S-5210.81-PLACEHOLDER",
  "normalization_status": "pdftotext",
  "normalized_sha256": "9ac64b76cf8295c0b1ce4142c5b8716795eeabc0d5b008c8b676ed375d7aa4c5",
  "normalized_text_path": "/srv/Collab/mini.shops/blackindex/normalized/text/DOD-2017-dod-controlled-issuance-placeholders-001.txt",
  "original_filename": "url-ingest.J9sEpw.pdf",
  "record_group": null,
  "redaction_note": null,
  "retrieved_at": "2026-09-27T09:44:08+00:00",
  "schema_version": 1,
  "series": null,
  "sha256": "54714dc4828f2e7596671c752863e7d82e99faa21bb5647a56c5cfc6da641561",
  "size_bytes": 165365,
  "source": "DOD",
  "source_url": "https://www.esd.whs.mil/Portals/54/Documents/DD/issuances/dodd/S-521081_placeholder.pdf",
  "tags": [
    "nc3",
    "nuclear-command-control",
    "controlled-document",
    "access-boundary",
    "dod-directive",
    "public-placeholder"
  ],
  "title": "DoDD S-5210.81 \u2014 United States Nuclear Weapons Command and Control, Safety and Security \u2014 Public Placeholder",
  "year_bucket": "2017"
}
