{
  "artifact_url": "https://media.defense.gov/2021/Jul/20/2002806877/-1/-1/0/19751029_1970_DOC_FORDLIBRARY_GEN.PDF",
  "call_id": "CALL-MINARET",
  "canonical_landing_url": "https://www.nsa.gov/Helpful-Links/NSA-FOIA/Declassification-Transparency-Initiatives/Historical-Releases/NSA-60th-Timeline/smdpage14701/7/",
  "classification_note": null,
  "collection": "MINARET",
  "doc_id": "NSA-1975-minaret-001",
  "document_date": "1975-10-29",
  "evidence_status": "unreviewed",
  "local_raw_path": "/srv/Collab/mini.shops/blackindex/source-vault/raw/nsa/minaret/NSA-1975-minaret-001.pdf",
  "mime_hint": "pdf",
  "native_id": "Ford Library / NSA 19751029_1970_DOC_FORDLIBRARY_GEN",
  "normalization_status": "pdftotext",
  "normalized_sha256": "3c2c23f0306e00ad31ac46fb7d8c71bfd8ed454e6ef0c323eca462d542f0042d",
  "normalized_text_path": "/srv/Collab/mini.shops/blackindex/normalized/text/NSA-1975-minaret-001.txt",
  "original_filename": "url-ingest.YkawN2.pdf",
  "record_group": null,
  "redaction_note": "Preserve classified/withheld sections and distinguish foreign-intelligence collection from U.S.-person watch-list selection and dissemination.",
  "retrieved_at": "2026-08-25T06:35:38+00:00",
  "schema_version": 1,
  "series": null,
  "sha256": "0209ef22384f60158b2ba6f5b29487c599c850c9f58dd3e058ee68e80f34bcd9",
  "size_bytes": 2909980,
  "source": "NSA",
  "source_url": "https://media.defense.gov/2021/Jul/20/2002806877/-1/-1/0/19751029_1970_DOC_FORDLIBRARY_GEN.PDF",
  "tags": [
    "minaret",
    "nsa",
    "watch-list",
    "domestic-surveillance",
    "communications-intelligence",
    "americans",
    "oversight"
  ],
  "title": "Statement of Lt. General Lew Allen, Jr. before the Senate Select Committee on Intelligence \u2014 Watch List Activity",
  "year_bucket": "1975"
}
