{
  "artifact_url": "https://www.cia.gov/readingroom/docs/family%20jewels%5B15132295%5D.pdf",
  "call_id": "CALL-003",
  "canonical_landing_url": "https://www.cia.gov/readingroom/collection/family-jewels",
  "classification_note": null,
  "collection": "Family Jewels",
  "doc_id": "CIA-1973-family-jewels-001",
  "document_date": null,
  "evidence_status": "unreviewed",
  "local_raw_path": "/srv/Collab/mini.shops/blackindex/source-vault/raw/cia/family-jewels/CIA-1973-family-jewels-001.pdf",
  "mime_hint": "pdf",
  "native_id": null,
  "normalization_status": "pdftotext",
  "normalized_sha256": "adf0c24ba2c0150c9bd4b95aae97074524ce954939ae9d59ae08453824307429",
  "normalized_text_path": "/srv/Collab/mini.shops/blackindex/normalized/text/CIA-1973-family-jewels-001.txt",
  "original_filename": "url-ingest.IIMV1Z.pdf",
  "record_group": null,
  "redaction_note": "Review redactions, withheld identities, missing attachments, and context gaps before promotion",
  "retrieved_at": "2026-08-25T04:12:38+00:00",
  "schema_version": 1,
  "series": null,
  "sha256": "7bb69fa0a0af4fc8104f0ae4804b87cccaf33bb2070e7ef229529d591e64bdfc",
  "size_bytes": 938651,
  "source": "CIA",
  "source_url": "https://www.cia.gov/readingroom/docs/family%20jewels%5B15132295%5D.pdf",
  "tags": [
    "family-jewels",
    "cia",
    "oversight",
    "domestic-activities",
    "assassination-planning",
    "mail-opening",
    "surveillance"
  ],
  "title": "Family Jewels",
  "year_bucket": "1973"
}
