{
  "artifact_url": "https://www.cia.gov/readingroom/docs/CIA-RDP99-00498R000300020007-3.pdf",
  "call_id": "CALL-MKSEARCH",
  "canonical_landing_url": "https://www.cia.gov/readingroom/document/cia-rdp99-00498r000300020007-3",
  "classification_note": null,
  "collection": "MKSEARCH",
  "doc_id": "CIA-1977-mksearch-001",
  "document_date": "1977-09-21",
  "evidence_status": "unreviewed",
  "local_raw_path": "/srv/Collab/mini.shops/blackindex/source-vault/raw/cia/mksearch/CIA-1977-mksearch-001.pdf",
  "mime_hint": "pdf",
  "native_id": "CIA-RDP99-00498R000300020007-3",
  "normalization_status": "pdf-no-text-layer",
  "normalized_sha256": null,
  "normalized_text_path": null,
  "original_filename": "url-ingest.vGXiL6.pdf",
  "record_group": null,
  "redaction_note": null,
  "retrieved_at": "2026-08-25T11:52:47+00:00",
  "schema_version": 1,
  "series": null,
  "sha256": "a6c7e9faad502cfeeda7d699bcefc5480c7a55f4a424f1b14ce1a543ea361e2e",
  "size_bytes": 311081,
  "source": "CIA",
  "source_url": "https://www.cia.gov/readingroom/docs/CIA-RDP99-00498R000300020007-3.pdf",
  "tags": [
    "mksearch",
    "mkultra",
    "often",
    "chickwit",
    "record-gaps",
    "financial-records",
    "drug-research"
  ],
  "title": "Statement of Director of Central Intelligence before Subcommittee on Health and Scientific Research \u2014 MKSEARCH/OFTEN/CHICKWIT",
  "year_bucket": "1977"
}
