{
  "artifact_url": "https://www.war.gov/News/Contracts/Contract/Article/4590748/contracts-for-sept-3-2026/",
  "call_id": "CALL-NC3-EXECUTION-FOLLOWUP-006",
  "canonical_landing_url": null,
  "classification_note": "Official DoD/War.gov SAOC contract-modification record. Canon use is limited to the dated funded contract action and stated scope; no successful performance, delivery, acceptance, certification, readiness, or use is inferred.",
  "collection": "Contract Announcements",
  "doc_id": "DOD-2026-contract-announcements-003",
  "document_date": "2026-09-03",
  "evidence_status": "reviewed",
  "local_raw_path": "/srv/Collab/mini.shops/blackindex/source-vault/raw/dod/contract-announcements/DOD-2026-contract-announcements-003.html",
  "mime_hint": "html",
  "native_id": "DOW-CONTRACTS-2026-09-03",
  "normalization_status": "html-visible-text",
  "normalized_sha256": "f2e0c9b4bb386c4220b328a1f5fec682fe1c3de025d0f530d6b0c4b93ea2d9ad",
  "normalized_text_path": "/srv/Collab/mini.shops/blackindex/normalized/text/DOD-2026-contract-announcements-003.txt",
  "original_filename": "html-ingest.Z844WC.html",
  "record_group": null,
  "redaction_note": "Public first-party contract announcement; modification/funding evidence does not establish successful performance, acceptance, certification, readiness, or operational use.",
  "retrieved_at": "2026-10-03T00:11:02+00:00",
  "schema_version": 1,
  "series": null,
  "sha256": "0b4db4d0f52ff96f349480fcf742bd6e82dcd2a84fe58c7e371ab2e03ef9a51e",
  "size_bytes": 130047,
  "source": "DOD",
  "source_url": "https://www.war.gov/News/Contracts/Contract/Article/4590748/contracts-for-sept-3-2026/",
  "tags": [
    "nc3",
    "saoc",
    "e-4c",
    "contract",
    "p00037",
    "rdte",
    "official-dod"
  ],
  "title": "Contracts for Sept. 3, 2026 \u2014 SAOC Contract Modification P00037",
  "year_bucket": "2026"
}
