{
  "artifact_url": "https://nara-media-001.s3.amazonaws.com/arcmedia/research/pentagon-papers/Pentagon-Papers-Index.pdf",
  "call_id": "CALL-004",
  "canonical_landing_url": "https://www.archives.gov/research/pentagon-papers",
  "classification_note": null,
  "collection": "Pentagon Papers",
  "doc_id": "NARA-1969-pentagon-papers-001",
  "document_date": null,
  "evidence_status": "unreviewed",
  "local_raw_path": "/srv/Collab/mini.shops/blackindex/source-vault/raw/nara/pentagon-papers/NARA-1969-pentagon-papers-001.pdf",
  "mime_hint": "pdf",
  "native_id": "NARA 5890484",
  "normalization_status": "pdftotext",
  "normalized_sha256": "c3a81dd45b0717b75dcd54194606cc4cfe17385f6fd7e41659b983b33c631687",
  "normalized_text_path": "/srv/Collab/mini.shops/blackindex/normalized/text/NARA-1969-pentagon-papers-001.txt",
  "original_filename": "url-ingest.8cbx1L.pdf",
  "record_group": null,
  "redaction_note": "NARA states the 2011 complete release is unredacted; retain version/release provenance because earlier public editions were incomplete.",
  "retrieved_at": "2026-08-25T05:58:31+00:00",
  "schema_version": 1,
  "series": null,
  "sha256": "542eebbc6f5376983043fa8fb9c096f0e0b651bd271f20c6a95214a9781a5d0d",
  "size_bytes": 1435178,
  "source": "NARA",
  "source_url": "https://nara-media-001.s3.amazonaws.com/arcmedia/research/pentagon-papers/Pentagon-Papers-Index.pdf",
  "tags": [
    "pentagon-papers",
    "vietnam",
    "nara",
    "index",
    "decision-history",
    "public-statements",
    "internal-documents"
  ],
  "title": "Report of the Office of the Secretary of Defense Vietnam Task Force \u2014 Index",
  "year_bucket": "1969"
}
