{
  "artifact_url": "https://vault.fbi.gov/9-11%20Commission%20Report/9-11-investigation-2002-04-apr/",
  "call_id": "CALL-911-REVIEW007G-ABDULLAH-FBI-BUNDLES",
  "canonical_landing_url": "https://vault.fbi.gov/9-11%20Commission%20Report/9-11-investigation-2002-04-apr/",
  "classification_note": null,
  "collection": "9/11 Commission FBI Monthly Releases April 2002",
  "doc_id": "FBI-2002-9-11-commission-fbi-monthly-releases-april-2002-001",
  "document_date": null,
  "evidence_status": "unreviewed",
  "local_raw_path": "/srv/Collab/mini.shops/blackindex/source-vault/raw/fbi/9-11-commission-fbi-monthly-releases-april-2002/FBI-2002-9-11-commission-fbi-monthly-releases-april-2002-001.pdf",
  "mime_hint": "pdf",
  "native_id": "FBI-911-INV-2002-04-APR",
  "normalization_status": "pdftotext",
  "normalized_sha256": "a8c8f1c412e9f4bc4a961a73404182722e7297dcd21ca0b4e0ec0e05c2e95b1a",
  "normalized_text_path": "/srv/Collab/mini.shops/blackindex/normalized/text/FBI-2002-9-11-commission-fbi-monthly-releases-april-2002-001.txt",
  "original_filename": "url-ingest.nguIit.pdf",
  "record_group": null,
  "redaction_note": null,
  "retrieved_at": "2026-09-26T06:12:30+00:00",
  "schema_version": 1,
  "series": null,
  "sha256": "54bea9b4f04cf2400e92a28c67ebba4c362110e6b9c4520e1dab2eed87377600",
  "size_bytes": 609350,
  "source": "FBI",
  "source_url": "https://vault.fbi.gov/9-11%20Commission%20Report/9-11-investigation-2002-04-apr/",
  "tags": [
    "9-11",
    "fbi",
    "penttbom",
    "mohdar-abdullah",
    "commission-source-files",
    "underlying-records",
    "official-fbi-release"
  ],
  "title": "FBI 9/11 Investigation \u2014 April 2002 Release Bundle",
  "year_bucket": "2002"
}
