{
  "artifact_url": "https://vault.fbi.gov/9-11-attacks-investigation-and-related-materials/9-11-material-released-in-response-to-executive-order-14040/april-4-2016-electronic-communication-part-01-of-01/at_download/file",
  "call_id": "CALL-911-ENCORE-DEEP",
  "canonical_landing_url": "https://vault.fbi.gov/9-11-attacks-investigation-and-related-materials/9-11-material-released-in-response-to-executive-order-14040/april-4-2016-electronic-communication-part-01-of-01/view",
  "classification_note": null,
  "collection": "Operation Encore Underlying Records",
  "doc_id": "FBI-2016-operation-encore-underlying-records-001",
  "document_date": "2016-04-04",
  "evidence_status": "unreviewed",
  "local_raw_path": "/srv/Collab/mini.shops/blackindex/source-vault/raw/fbi/operation-encore-underlying-records/FBI-2016-operation-encore-underlying-records-001.pdf",
  "mime_hint": "pdf",
  "native_id": "EO14040 April 4 2016 EC",
  "normalization_status": "pdftotext",
  "normalized_sha256": "48ddfa50b0f91655cf3ec07599bf1f37c04d89898ca5d49ec28042f03ebb41d7",
  "normalized_text_path": "/srv/Collab/mini.shops/blackindex/normalized/text/FBI-2016-operation-encore-underlying-records-001.txt",
  "original_filename": "url-ingest.a4TzoF.pdf",
  "record_group": null,
  "redaction_note": null,
  "retrieved_at": "2026-08-26T02:12:57+00:00",
  "schema_version": 1,
  "series": null,
  "sha256": "5efb8f246c7cf33ab48b7798c3f4346a29fb390d7371d07d802ee669a86743cf",
  "size_bytes": 3947562,
  "source": "FBI",
  "source_url": "https://vault.fbi.gov/9-11-attacks-investigation-and-related-materials/9-11-material-released-in-response-to-executive-order-14040/april-4-2016-electronic-communication-part-01-of-01/at_download/file",
  "tags": [
    "9-11",
    "operation-encore",
    "fbi",
    "2016-ec",
    "bayoumi",
    "thumairy",
    "al-jarrah",
    "underlying-record"
  ],
  "title": "April 4, 2016 Electronic Communication \u2014 Operation Encore / PENTTBOM follow-on investigation",
  "year_bucket": "2016"
}
