{
  "artifact_url": "https://www.cia.gov/readingroom/docs/DOC_0000935207.pdf",
  "call_id": "CALL-PBSUCCESS-DEEP",
  "canonical_landing_url": "https://www.cia.gov/readingroom/",
  "classification_note": null,
  "collection": "PBSUCCESS Historical Review",
  "doc_id": "CIA-1954-pbsuccess-historical-review-001",
  "document_date": null,
  "evidence_status": "unreviewed",
  "local_raw_path": "/srv/Collab/mini.shops/blackindex/source-vault/raw/cia/pbsuccess-historical-review/CIA-1954-pbsuccess-historical-review-001.pdf",
  "mime_hint": "pdf",
  "native_id": "0000935207",
  "normalization_status": "pdf-no-text-layer",
  "normalized_sha256": null,
  "normalized_text_path": null,
  "original_filename": "url-ingest.MWMmzD.pdf",
  "record_group": null,
  "redaction_note": null,
  "retrieved_at": "2026-08-25T11:52:43+00:00",
  "schema_version": 1,
  "series": null,
  "sha256": "6ce0e1f27920c12861815d835ee1372217421c05626fbc38505bfbba34738282",
  "size_bytes": 9142747,
  "source": "CIA",
  "source_url": "https://www.cia.gov/readingroom/docs/DOC_0000935207.pdf",
  "tags": [
    "pbsuccess",
    "guatemala-1954",
    "historical-review",
    "field-operations",
    "guatemala-city"
  ],
  "title": "PBSUCCESS CIA Historical Review \u2014 undercover field account",
  "year_bucket": "1954"
}
