{
  "artifact_url": "https://nsarchive.gwu.edu/sites/default/files/documents/3224973/04-NSC-Memorandum-from-Oliver-L-North-to-Robert.pdf",
  "call_id": "CALL-005",
  "canonical_landing_url": "https://nsarchive.gwu.edu/document/22305-04-nsc-memorandum-oliver-l-north-robert",
  "classification_note": null,
  "collection": "Iran-Contra",
  "doc_id": "NSC-1985-iran-contra-001",
  "document_date": "1985-03-16",
  "evidence_status": "unreviewed",
  "local_raw_path": "/srv/Collab/mini.shops/blackindex/source-vault/raw/nsc/iran-contra/NSC-1985-iran-contra-001.pdf",
  "mime_hint": "pdf",
  "native_id": "NSC System IV 400246",
  "normalization_status": "pdf-no-text-layer",
  "normalized_sha256": null,
  "normalized_text_path": null,
  "original_filename": "url-ingest.x6rp71.pdf",
  "record_group": null,
  "redaction_note": "Packet contains original and altered versions. Preserve version identity and do not merge differing language into a single record.",
  "retrieved_at": "2026-08-25T05:58:37+00:00",
  "schema_version": 1,
  "series": null,
  "sha256": "e9ac72e94c8684f04088d044f9d2fc026044e5a1508c11c7258b441ef505afaa",
  "size_bytes": 300978,
  "source": "NSC",
  "source_url": "https://nsarchive.gwu.edu/sites/default/files/documents/3224973/04-NSC-Memorandum-from-Oliver-L-North-to-Robert.pdf",
  "tags": [
    "iran-contra",
    "nsc",
    "oliver-north",
    "nicaragua",
    "contras",
    "system-iv",
    "record-integrity",
    "altered-record"
  ],
  "title": "Fallback Plan for the Nicaraguan Resistance \u2014 original and altered versions",
  "year_bucket": "1985"
}
