{
  "artifact_url": "https://www.cia.gov/readingroom/docs/DOC_0000914015.pdf",
  "call_id": "CALL-PBSUCCESS-DEEP",
  "canonical_landing_url": "https://www.cia.gov/readingroom/document/0000914015",
  "classification_note": null,
  "collection": "PBSUCCESS Record Custody",
  "doc_id": "CIA-1954-pbsuccess-record-custody-001",
  "document_date": "1954-01-02",
  "evidence_status": "unreviewed",
  "local_raw_path": "/srv/Collab/mini.shops/blackindex/source-vault/raw/cia/pbsuccess-record-custody/CIA-1954-pbsuccess-record-custody-001.pdf",
  "mime_hint": "pdf",
  "native_id": "0000914015",
  "normalization_status": "pdf-no-text-layer",
  "normalized_sha256": null,
  "normalized_text_path": null,
  "original_filename": "url-ingest.NeE39D.pdf",
  "record_group": null,
  "redaction_note": null,
  "retrieved_at": "2026-08-25T11:52:35+00:00",
  "schema_version": 1,
  "series": null,
  "sha256": "7a05288a2fcb4e263e09a3bfbfc05c2e0c6323465ffa662aa5faa4619dd76d96",
  "size_bytes": 160738,
  "source": "CIA",
  "source_url": "https://www.cia.gov/readingroom/docs/DOC_0000914015.pdf",
  "tags": [
    "pbsuccess",
    "guatemala-1954",
    "record-custody",
    "chain-of-custody",
    "covert-action"
  ],
  "title": "Custody of PBSUCCESS Material (with attachments)",
  "year_bucket": "1954"
}
