{
  "artifact_url": "https://www.cia.gov/readingroom/docs/DOC_0001342704.pdf",
  "call_id": "CALL-MHCHAOS",
  "canonical_landing_url": "https://www.cia.gov/readingroom/",
  "classification_note": null,
  "collection": "MHCHAOS",
  "doc_id": "CIA-1993-mhchaos-001",
  "document_date": null,
  "evidence_status": "unreviewed",
  "local_raw_path": "/srv/Collab/mini.shops/blackindex/source-vault/raw/cia/mhchaos/CIA-1993-mhchaos-001.pdf",
  "mime_hint": "pdf",
  "native_id": "DOC_0001342704",
  "normalization_status": "pdf-no-text-layer",
  "normalized_sha256": null,
  "normalized_text_path": null,
  "original_filename": "url-ingest.PYhYIP.pdf",
  "record_group": null,
  "redaction_note": null,
  "retrieved_at": "2026-08-25T10:54:43+00:00",
  "schema_version": 1,
  "series": null,
  "sha256": "0bf1a34a1e4362e4cd23b1d6c5d94361fa3f9e18c89afe9ab396d12dbcf8bd8c",
  "size_bytes": 10668970,
  "source": "CIA",
  "source_url": "https://www.cia.gov/readingroom/docs/DOC_0001342704.pdf",
  "tags": [
    "mhchaos",
    "operation-chaos",
    "cia",
    "antiwar",
    "domestic-intelligence",
    "foreign-influence"
  ],
  "title": "Richard Helms as Director of Central Intelligence \u2014 MHCHAOS: CIA and the Antiwar Movement",
  "year_bucket": "1993"
}
