{
  "artifact_url": "https://www.stratcom.mil/Media/News/News-Article-View/article/1805006/usstratcom-announces-initial-operational-capability-of-nc3-enterprise-center/",
  "call_id": "CALL-NC3-EXECUTION-003",
  "canonical_landing_url": null,
  "classification_note": "Official USSTRATCOM IOC announcement for the NC3 Enterprise Center; establishes the stated organizational IOC milestone and assigned enterprise role, not the content of controlled directives or every downstream capability.",
  "collection": "News Releases",
  "doc_id": "USSTRATCOM-2019-news-releases-001",
  "document_date": "2019-04-03",
  "evidence_status": "unreviewed",
  "local_raw_path": "/srv/Collab/mini.shops/blackindex/source-vault/raw/usstratcom/news-releases/USSTRATCOM-2019-news-releases-001.html",
  "mime_hint": "html",
  "native_id": "Article-1805006",
  "normalization_status": "html-visible-text",
  "normalized_sha256": "ed25370265594c78ea39606c2923445bf33f9e73b5d342a205c3025e1b887cee",
  "normalized_text_path": "/srv/Collab/mini.shops/blackindex/normalized/text/USSTRATCOM-2019-news-releases-001.txt",
  "original_filename": "html-ingest.Zd8rEK.html",
  "record_group": null,
  "redaction_note": null,
  "retrieved_at": "2026-10-02T04:42:55+00:00",
  "schema_version": 1,
  "series": null,
  "sha256": "86701b88768af2093b27dcbe9f7ece1528b5ed7d5e2a4965f530e71c15f55879",
  "size_bytes": 70681,
  "source": "USSTRATCOM",
  "source_url": "https://www.stratcom.mil/Media/News/News-Article-View/article/1805006/usstratcom-announces-initial-operational-capability-of-nc3-enterprise-center/",
  "tags": [
    "nc3",
    "enterprise-center",
    "nec",
    "initial-operational-capability",
    "usstratcom",
    "first-party-html"
  ],
  "title": "USSTRATCOM announces initial operational capability of NC3 Enterprise Center",
  "year_bucket": "2019"
}
