{
  "artifact_url": "https://www.govinfo.gov/content/pkg/CRPT-107hrpt792/pdf/CRPT-107hrpt792.pdf",
  "call_id": "CALL-911-OFFICIAL-BASELINES",
  "canonical_landing_url": "https://www.govinfo.gov/app/details/CRPT-107hrpt792/CRPT-107hrpt792",
  "classification_note": null,
  "collection": "9/11 Joint Inquiry",
  "doc_id": "US CONGRESS-2002-9-11-joint-inquiry-001",
  "document_date": "2002-12-20",
  "evidence_status": "unreviewed",
  "local_raw_path": "/srv/Collab/mini.shops/blackindex/source-vault/raw/us congress/9-11-joint-inquiry/US CONGRESS-2002-9-11-joint-inquiry-001.pdf",
  "mime_hint": "pdf",
  "native_id": "S.Rept.107-351-H.Rept.107-792",
  "normalization_status": "pdftotext",
  "normalized_sha256": "5a16137bd8ad2ca5a62056442499ef2696d0f2318d3c7d38340ffa67a986f3a9",
  "normalized_text_path": "/srv/Collab/mini.shops/blackindex/normalized/text/US CONGRESS-2002-9-11-joint-inquiry-001.txt",
  "original_filename": "url-ingest.mKreuJ.pdf",
  "record_group": null,
  "redaction_note": null,
  "retrieved_at": "2026-08-27T15:28:09+00:00",
  "schema_version": 1,
  "series": null,
  "sha256": "346e0b867a0c140383aa3709943911d44e21a3fcdf793243af80ae9bf3a1825d",
  "size_bytes": 5155232,
  "source": "US CONGRESS",
  "source_url": "https://www.govinfo.gov/content/pkg/CRPT-107hrpt792/pdf/CRPT-107hrpt792.pdf",
  "tags": [
    "9-11",
    "joint-inquiry",
    "congress",
    "foreign-support",
    "bayoumi",
    "hazmi",
    "mihdhar",
    "official-interpretation",
    "declassified-report"
  ],
  "title": "Joint Inquiry into Intelligence Community Activities Before and After the Terrorist Attacks of September 11, 2001 \u2014 Declassified Final Report",
  "year_bucket": "2002"
}
