{
  "artifact_url": "https://www.secnav.navy.mil/fmc/fmb/Documents/26pres/RDTEN_BA5_Book.pdf",
  "call_id": "CALL-NC3-PROGRAM-GENEALOGY-001",
  "canonical_landing_url": "https://www.secnav.navy.mil/fmc/fmb/Pages/Fiscal-Year-2026.aspx",
  "classification_note": null,
  "collection": "FY 2026 RDT&E Budget Justification Books",
  "doc_id": "US_NAVY-2025-fy-2026-rdt-e-budget-justification-books-002",
  "document_date": null,
  "evidence_status": "reviewed",
  "local_raw_path": "/srv/Collab/mini.shops/blackindex/source-vault/raw/us-navy/fy-2026-rdt-e-budget-justification-books/US_NAVY-2025-fy-2026-rdt-e-budget-justification-books-002.pdf",
  "mime_hint": "pdf",
  "native_id": "FY26-RDTEN-BA5",
  "normalization_status": "pdftotext",
  "normalized_sha256": "8a25fdf44f424b03d8fc127216170f8d03630dcefae42af9d651e01d60dac391",
  "normalized_text_path": "/srv/Collab/mini.shops/blackindex/normalized/text/US_NAVY-2025-fy-2026-rdt-e-budget-justification-books-002.txt",
  "original_filename": "url-ingest.45qHct.pdf",
  "record_group": null,
  "redaction_note": "Public budget justification record. Treat planned funding, schedules, quantities, tests, deliveries, and milestones as budget/program statements unless separately confirmed by execution evidence.",
  "retrieved_at": "2026-10-02T18:34:37+00:00",
  "schema_version": 1,
  "series": null,
  "sha256": "d5f5c1181e9b1885373670338b582efad52f1066f9abb0aaf032c368f90a8333",
  "size_bytes": 80984946,
  "source": "US_NAVY",
  "source_url": "https://www.secnav.navy.mil/fmc/fmb/Documents/26pres/RDTEN_BA5_Book.pdf",
  "tags": [
    "nc3",
    "tacamo",
    "e-130j",
    "rdte",
    "budget",
    "program-record",
    "official-navy-budget"
  ],
  "title": "Department of the Navy FY 2026 RDT&E Budget Estimates \u2014 BA 5 Justification Book",
  "year_bucket": "2025"
}
