{
  "artifact_url": "https://www.navair.navy.mil/product/E-6B-Mercury",
  "call_id": "CALL-NC3-PROGRAM-HTML-001",
  "canonical_landing_url": null,
  "classification_note": "Living first-party NAVAIR product/program page captured as a retrieval-state snapshot; not an operating directive or independent underlying program record.",
  "collection": "Product Pages",
  "doc_id": "NAVAIR-2026-product-pages-001",
  "document_date": null,
  "evidence_status": "unreviewed",
  "local_raw_path": "/srv/Collab/mini.shops/blackindex/source-vault/raw/navair/product-pages/NAVAIR-2026-product-pages-001.html",
  "mime_hint": "html",
  "native_id": "E-6B-Mercury",
  "normalization_status": "html-visible-text",
  "normalized_sha256": "ce4763efa58f91ee93eb3b1dcf62d0ee4bd4eba16b70ce116b82566e6b1e9eef",
  "normalized_text_path": "/srv/Collab/mini.shops/blackindex/normalized/text/NAVAIR-2026-product-pages-001.txt",
  "original_filename": "html-ingest.06Q3Vm.html",
  "record_group": null,
  "redaction_note": null,
  "retrieved_at": "2026-10-02T00:48:23+00:00",
  "schema_version": 1,
  "series": null,
  "sha256": "a3bdda57203a8f3011bd552fad07a7b759919c19f888fc60efa7230a55e0071a",
  "size_bytes": 154841,
  "source": "NAVAIR",
  "source_url": "https://www.navair.navy.mil/product/E-6B-Mercury",
  "tags": [
    "nc3",
    "tacamo",
    "e-6b",
    "e-130j",
    "pma-271",
    "first-party-html",
    "program-page"
  ],
  "title": "E-6B Mercury",
  "year_bucket": "2026"
}
