{
  "artifact_url": "https://vault.fbi.gov/9-11-attacks-investigation-and-related-materials/9-11-material-released-in-response-to-executive-order-14040/documents-responsive-to-executive-order-14040-2-c-part-1/at_download/file",
  "call_id": "CALL-911-ENCORE-DEEP",
  "canonical_landing_url": "https://vault.fbi.gov/9-11-attacks-investigation-and-related-materials/9-11-material-released-in-response-to-executive-order-14040/documents-responsive-to-executive-order-14040-2-c-part-1/view",
  "classification_note": null,
  "collection": "EO14040 2(c)",
  "doc_id": "FBI-2022-eo14040-2-c-001",
  "document_date": null,
  "evidence_status": "unreviewed",
  "local_raw_path": "/srv/Collab/mini.shops/blackindex/source-vault/raw/fbi/eo14040-2-c/FBI-2022-eo14040-2-c-001.pdf",
  "mime_hint": "pdf",
  "native_id": "EO14040-2c-Part01",
  "normalization_status": "pdftotext",
  "normalized_sha256": "b18a557d3469572df35f5ef8ffb491cc7614bc95bbfa07f61a4e3c48ae87d9ac",
  "normalized_text_path": "/srv/Collab/mini.shops/blackindex/normalized/text/FBI-2022-eo14040-2-c-001.txt",
  "original_filename": "url-ingest.Sob3fe.pdf",
  "record_group": null,
  "redaction_note": null,
  "retrieved_at": "2026-08-26T02:13:22+00:00",
  "schema_version": 1,
  "series": null,
  "sha256": "c7960258fa7feff92d3386da7eb7b6cb0effa457780fd756cbf43ee5fc6985b6",
  "size_bytes": 47273881,
  "source": "FBI",
  "source_url": "https://vault.fbi.gov/9-11-attacks-investigation-and-related-materials/9-11-material-released-in-response-to-executive-order-14040/documents-responsive-to-executive-order-14040-2-c-part-1/at_download/file",
  "tags": [
    "9-11",
    "eo14040",
    "fbi",
    "underlying-records",
    "section-2c",
    "release-package"
  ],
  "title": "Documents Responsive to Executive Order 14040 Section 2(c) \u2014 Part 1",
  "year_bucket": "2022"
}
