{
  "artifact_url": "https://www.cia.gov/readingroom/docs/DOC_0000923924.pdf",
  "call_id": "CALL-PBSUCCESS-DEEP",
  "canonical_landing_url": "https://www.cia.gov/readingroom/document/0000923924",
  "classification_note": null,
  "collection": "PBSUCCESS Operational Support",
  "doc_id": "CIA-1954-pbsuccess-operational-support-001",
  "document_date": "1954-01-02",
  "evidence_status": "unreviewed",
  "local_raw_path": "/srv/Collab/mini.shops/blackindex/source-vault/raw/cia/pbsuccess-operational-support/CIA-1954-pbsuccess-operational-support-001.pdf",
  "mime_hint": "pdf",
  "native_id": "0000923924",
  "normalization_status": "pdf-no-text-layer",
  "normalized_sha256": null,
  "normalized_text_path": null,
  "original_filename": "url-ingest.3d4ld9.pdf",
  "record_group": null,
  "redaction_note": null,
  "retrieved_at": "2026-08-25T11:52:39+00:00",
  "schema_version": 1,
  "series": null,
  "sha256": "d2de169762491ddb2c4f22b832a1448af2a596b31f5a9d52700c5797fa263f3a",
  "size_bytes": 206926,
  "source": "CIA",
  "source_url": "https://www.cia.gov/readingroom/docs/DOC_0000923924.pdf",
  "tags": [
    "pbsuccess",
    "guatemala-1954",
    "logistics",
    "operational-support",
    "covert-action"
  ],
  "title": "The PBSUCCESS Operational Support Plan",
  "year_bucket": "1954"
}
