{
  "artifact_url": "https://www.defense.gov/News/Contracts/Contract/Article/4011154/",
  "call_id": "CALL-NC3-E130J-AWARD-002",
  "canonical_landing_url": null,
  "classification_note": "Official DoD contract announcement for the E-130J TACAMO engineering and manufacturing development award; establishes the award action but not later performance, delivery, readiness, or operational use.",
  "collection": "Contract Announcements",
  "doc_id": "DOD-2024-contract-announcements-001",
  "document_date": "2024-12-18",
  "evidence_status": "unreviewed",
  "local_raw_path": "/srv/Collab/mini.shops/blackindex/source-vault/raw/dod/contract-announcements/DOD-2024-contract-announcements-001.html",
  "mime_hint": "html",
  "native_id": "Article-4011154",
  "normalization_status": "html-visible-text",
  "normalized_sha256": "eb2e38689a9e9261c7aabb8b3dcba687f468c853f58d4ff5c080c17297cec4f8",
  "normalized_text_path": "/srv/Collab/mini.shops/blackindex/normalized/text/DOD-2024-contract-announcements-001.txt",
  "original_filename": "html-ingest.Pvv6ex.html",
  "record_group": null,
  "redaction_note": null,
  "retrieved_at": "2026-10-02T01:08:15+00:00",
  "schema_version": 1,
  "series": null,
  "sha256": "bfe2248e39d24838b44c5cb631339b834f8ac5cbd772b78304005c459ce255e7",
  "size_bytes": 129564,
  "source": "DOD",
  "source_url": "https://www.defense.gov/News/Contracts/Contract/Article/4011154/",
  "tags": [
    "nc3",
    "tacamo",
    "e-130j",
    "e-6b",
    "contract-award",
    "dod-contracts",
    "first-party-html"
  ],
  "title": "Contracts For Dec. 18, 2024 \u2014 E-130J TACAMO Award",
  "year_bucket": "2024"
}
