{
  "artifact_url": "https://media.defense.gov/2010/Nov/05/2001329896/-1/-1/0/AFD-101105-002.pdf",
  "call_id": "CALL-LOOKING-GLASS-OFFICIAL-BASELINE",
  "canonical_landing_url": null,
  "classification_note": null,
  "collection": "Air Force History and Museums Program",
  "doc_id": "USAF-1997-air-force-history-and-museums-program-001",
  "document_date": null,
  "evidence_status": "unreviewed",
  "local_raw_path": "/srv/Collab/mini.shops/blackindex/source-vault/raw/usaf/air-force-history-and-museums-program/USAF-1997-air-force-history-and-museums-program-001.pdf",
  "mime_hint": "pdf",
  "native_id": "AFHMP-WINGED-SHIELD-WINGED-SWORD-VOL-II",
  "normalization_status": "pdftotext",
  "normalized_sha256": "3eed338ba7b3392fc7b67c212fa9fc514655f4900f4fdb72eec9808f32730e33",
  "normalized_text_path": "/srv/Collab/mini.shops/blackindex/normalized/text/USAF-1997-air-force-history-and-museums-program-001.txt",
  "original_filename": "url-ingest.BhINBi.pdf",
  "record_group": null,
  "redaction_note": null,
  "retrieved_at": "2026-09-27T06:59:38+00:00",
  "schema_version": 1,
  "series": null,
  "sha256": "8dc2b384e88aebec6051f523d7ff3c32ce8a4a20cf9342f97c93c83ed5e9b138",
  "size_bytes": 15536329,
  "source": "USAF",
  "source_url": "https://media.defense.gov/2010/Nov/05/2001329896/-1/-1/0/AFD-101105-002.pdf",
  "tags": [
    "looking-glass",
    "sac",
    "air-force-history",
    "nuclear-command-control",
    "paccs",
    "cold-war",
    "official-usaf-history"
  ],
  "title": "Winged Shield, Winged Sword: A History of the United States Air Force, Volume II, 1950-1997",
  "year_bucket": "1997"
}
