{
  "artifact_url": "https://www.defense.gov/News/Contracts/Contract/article/3758114/",
  "call_id": "CALL-NC3-EXECUTION-001",
  "canonical_landing_url": null,
  "classification_note": "Official DoD contract-action record for the SAOC development and production award; establishes the award action and stated scope, not later performance, delivery, readiness, authority, or operational use.",
  "collection": "Contract Announcements",
  "doc_id": "DOD-2024-contract-announcements-002",
  "document_date": "2024-04-26",
  "evidence_status": "unreviewed",
  "local_raw_path": "/srv/Collab/mini.shops/blackindex/source-vault/raw/dod/contract-announcements/DOD-2024-contract-announcements-002.html",
  "mime_hint": "html",
  "native_id": "Article-3758114",
  "normalization_status": "html-visible-text",
  "normalized_sha256": "60c4b172eaa965732b7435f58b9d2a4a97bd88dfd9b801caa4b0b9ff737505eb",
  "normalized_text_path": "/srv/Collab/mini.shops/blackindex/normalized/text/DOD-2024-contract-announcements-002.txt",
  "original_filename": "html-ingest.uqjPIZ.html",
  "record_group": null,
  "redaction_note": null,
  "retrieved_at": "2026-10-02T04:42:22+00:00",
  "schema_version": 1,
  "series": null,
  "sha256": "47435a1a9fc2935efe4f85c15fb461ac84f1267201a9bac5b352397e1094e7b5",
  "size_bytes": 125559,
  "source": "DOD",
  "source_url": "https://www.defense.gov/News/Contracts/Contract/article/3758114/",
  "tags": [
    "nc3",
    "saoc",
    "e-4c",
    "contract-award",
    "aflcmc",
    "first-party-html"
  ],
  "title": "Contracts For April 26, 2024 \u2014 Survivable Airborne Operations Center Award",
  "year_bucket": "2024"
}
