{
  "artifact_url": "https://vault.fbi.gov/9-11-attacks-investigation-and-related-materials/9-11-material-released-in-response-to-executive-order-14040/documents-responsive-to-executive-order-14040-section-2-b-i-part-01-of-02/at_download/file",
  "call_id": "CALL-911-ENCORE-DEEP",
  "canonical_landing_url": "https://vault.fbi.gov/9-11-attacks-investigation-and-related-materials/9-11-material-released-in-response-to-executive-order-14040/documents-responsive-to-executive-order-14040-section-2-b-i-part-01-of-02/view",
  "classification_note": null,
  "collection": "EO14040 2(b)(i)",
  "doc_id": "FBI-2021-eo14040-2-b-i-001",
  "document_date": null,
  "evidence_status": "unreviewed",
  "local_raw_path": "/srv/Collab/mini.shops/blackindex/source-vault/raw/fbi/eo14040-2-b-i/FBI-2021-eo14040-2-b-i-001.pdf",
  "mime_hint": "pdf",
  "native_id": "EO14040-2b1-Part01",
  "normalization_status": "pdftotext",
  "normalized_sha256": "b7c4a95266aecb41e21f3668bb32b1f16ea887cc91020f22f0e577b8b4b6972b",
  "normalized_text_path": "/srv/Collab/mini.shops/blackindex/normalized/text/FBI-2021-eo14040-2-b-i-001.txt",
  "original_filename": "url-ingest.c9lgLr.pdf",
  "record_group": null,
  "redaction_note": null,
  "retrieved_at": "2026-08-26T02:13:08+00:00",
  "schema_version": 1,
  "series": null,
  "sha256": "288067203d5d22736a09f064020c529e06cc79db60b49fd7c665c032e44f3e00",
  "size_bytes": 96945362,
  "source": "FBI",
  "source_url": "https://vault.fbi.gov/9-11-attacks-investigation-and-related-materials/9-11-material-released-in-response-to-executive-order-14040/documents-responsive-to-executive-order-14040-section-2-b-i-part-01-of-02/at_download/file",
  "tags": [
    "9-11",
    "eo14040",
    "fbi",
    "underlying-records",
    "section-2b1",
    "release-package"
  ],
  "title": "Documents Responsive to Executive Order 14040 Section 2(b)(i) \u2014 Part 1 of 2",
  "year_bucket": "2021"
}
